<?xml version="1.1" encoding="UTF-8"?>
<specification defaultWorkgroup="cds" defaultVersion="1.2" url="http://www.hl7.org/implement/standards/product_brief.cfm?product_id=334" xmlns:xsi="http://www.w3.org/2001/XMLSchema-instance" xsi:noNamespaceSchemaLocation="../schemas/specification.xsd">
  <version code="1.2" deprecated="false"/>
  <version code="1.1" deprecated="false"/>
  <page name="1.0 - Introduction" key="1_intro"/>
  <page name="1.1 - S and I Framework HeD Initiative" key="1_1_hed_initiative"/>
  <page name="1.2 - Purpose" key="1_2_purpose"/>
  <page name="1.3 - Approach" key="1_3_approach"/>
  <page name="1.4 - Intended Audience" key="1_4_audience"/>
  <page name="1.5 - Conventions and Acronyms Used in this Guide" key="1_5_conventions"/>
  <page name="1.6 - Acronyms" key="1_6_acronyms"/>
  <page name="2.0 - Implementation Approach" key="2_0_impl_approach"/>
  <page name="2.1 - Pre-Conditions" key="2_1_pre_conditions"/>
  <page name="2.2 - Implementation Resources" key="2_2_impl_resources"/>
  <page name="2.3 - Service Interaction Framework" key="2_3_svc_ineract_xwork"/>
  <page name="2.4 - Content Payload Definition" key="2_4_cnt_payload_def"/>
  <page name="2.5 - Clinical Data Representation" key="2_5_data_rep"/>
  <page name="2.6 - Specification of Knowledge Module Meta-Data" key="2_6_meta_data"/>
  <page name="2.7 - Example Implementation" key="2_7_impl_example"/>
  <page name="Appendix A - Acronyms" key="app_a_acronyms"/>
  <page name="Appendix B - Glossary of Terms" key="app_b_glossary"/>
</specification>
  