<?xml version="1.0" encoding="UTF-8"?>
<specification xmlns:xsi="http://www.w3.org/2001/XMLSchema-instance" xsi:noNamespaceSchemaLocation="schemas/specification.xsd" defaultVersion="1.0.0" defaultWorkgroup="pher" url="https://www.hl7.org/documentcenter/public/ballots/2024JAN/downloads/CDAR2_IG_HAI_AU_LTCF_E1_D1_2024JAN.zip" >
    <version code="0.1.0" deprecated="false"/>
    <version code="1.0.0" deprecated="false"/>
    <page key="NA" name="(NA)"/>
    <page key="many" name="(many)"/>
    <page key="usecases" name="Use Cases"/>
    <page key="narratives" name="Narrative Guidance"/>
    <page key="templates" name="Templates"/>
    <page key="figures-examples" name="Figures and Examples"/>
    <page key="valuesets" name="Value sets"/>
    <page key="samplefiles" name="Sample Files"/>
    <page key="schematron" name="Schematron Validation Files"/>
</specification>
