<?xml version="1.1" encoding="UTF-8"?>
<specification xmlns:xsi="http://www.w3.org/2001/XMLSchema-instance"
	xsi:noNamespaceSchemaLocation="schemas/specification.xsd" defaultVersion="1.3.0"
	defaultWorkgroup="pher" url="http://www.hl7.org/implement/standards/product_brief.cfm?product_id=385">
	<!--<specification xmlns:xsi="http://www.w3.org/2001/XMLSchema-instance"
 xsi:noNamespaceSchemaLocation="schemas/specification.xsd" defaultVersion="STU3"
 defaultWorkgroup="ph">-->
	<version code="1.3.0" url="http://www.hl7.org/dstucomments/showdetail.cfm?dstuid=282" deprecated="false"/>
	<version code="1.2.0" url="http://www.hl7.org/dstucomments/showdetail.cfm?dstuid=267" deprecated="true"/>
	<version code="1.1.2" url="http://www.hl7.org/dstucomments/showdetail.cfm?dstuid=192" deprecated="true"/>
	<version code="1.1.1" url="http://www.hl7.org/dstucomments/ex_showdetail.cfm?dstuid=179" deprecated="true"/>
	<version code="1.1.0" url="http://www.hl7.org/dstucomments/ex_showdetail.cfm?dstuid=136" deprecated="true"/>
		<page key="NA" name="(NA)"/>
		<page key="many" name="(many)"/>
		<page key="usecases" name="Use Cases"/>
		<page key="narratives" name="Narrative Guidance"/>
		<page key="templates" name="Templates"/>
		<page key="figures-examples" name="Figures and Examples"/>
		<page key="valuesets" name="Value sets"/>
		<page key="samplefiles" name="Sample Files"/>
		<page key="schematron" name="Schematron Validation Files"/>
	</specification>
	