<?xml version="1.0" encoding="UTF-8"?>
<specification defaultWorkgroup="pher" defaultVersion="1.0" xmlns:xsi="http://www.w3.org/2001/XMLSchema-instance" xsi:noNamespaceSchemaLocation="../schemas/specification.xsd">
  <version code="1.0"/>
  <artifact name="ORU^R01 Profile" key="ORUprofile" id="ORU/DAR"/>
  <artifact name="ACK^R01 Profile" key="ACKprofile" id="ACK/DAR"/>
  <artifact name="MSH_EHDI01 Profile" key="MSH_EHDI01" id="MSH/EHDI01"/>
  <artifact name="MSH_EHDI02 Profile" key="MSH_EHDI02" id="MSH/EHDI02"/>
  <artifact name="PID_EHDI01 Profile" key="PID_EHDI01" id="PID/EHDI01"/>
  <artifact name="NK1_EHDI01 Profile" key="NK1_EHDI01" id="NK1/EHDI01"/>
  <artifact name="PV1_EHDI01 Profile" key="PV1_EHDI01" id="PV1/EHDI01"/>
  <artifact name="OBR_EHDI01 Profile" key="OBR_EHDI01" id="OBR/EHDI01"/>
  <artifact name="OBX_EHDI01 Profile" key="OBX_EHDI01" id="OBX/EHDI01"/>
  <artifact name="MSA_EHDI01 Profile" key="MSA_EHDI01" id="MSA/EHDI01"/>
  <artifact name="ERR_EHDI01 Profile" key="ERR_EHDI01" id="ERR/EHDI01"/>
  <artifact name="Value Sets" key="valuesets" id="VALUESET/EHDI"/>
  <artifact name="Data Type Flavors" key="datatypeflavors" id="DATATYPES/EHDI"/>
  <page name="Introduction" key="intro"/>
  <page name="Use Cases" key="usecases"/>
  <page name="Other" key="other"/>
</specification>