<?xml version="1.0" encoding="UTF-8"?>
<!-- This data is just for testing purposes and is not complete -->
<specification defaultWorkgroup="sd" defaultVersion="R2" xmlns:xsi="http://www.w3.org/2001/XMLSchema-instance" xsi:noNamespaceSchemaLocation="../schemas/specification.xsd">
  <version code="R1"/>
  <version code="R2"/>
  <version code="R2.1"/>
  <artifact name="SomeClass" key="someclass" id="1.2.3"/>
  <artifact name="SomeOtherClass6" key="someotherclass" id="0.1.2"/>
  <page name="(NA)" key="NA"/>
  <page name="(many)" key="many"/>
  <page name="(methodology)" key="methodology"/>
  <page name="(profiles)" key="profiles"/>
  <page name="Intro" key="intro"/>
</specification>
