<?xml version="1.1" encoding="UTF-8"?>
<specification defaultWorkgroup="pc" defaultVersion="1.0" 
    url="http://www.hl7.org/documentcenter/public/ballots/2025MAY/downloads/HL7_DAM_SB-PFT_E1_I1_2025MAY.zip" 
    xmlns:xsi="http://www.w3.org/2001/XMLSchema-instance" 
    xsi:noNamespaceSchemaLocation="../schemas/specification.xsd">
    <version code="1.0" deprecated="false"/>
    <page name="Background" key="Background"/>
    <page name="Purpose" key="Purpose"/>
    <page name="Acknowledgements" key="Acknowledgements"/>
    <page name="Use Cases" key="UseCases"/>
    <page name="Use Cases Activities" key="UseCasesActivities"/>
    <page name="Activity Process Flows" key="ActivityProcessFlows"/>
    <page name="Interactions" key="Interactions"/>
    <page name="Information Viewpoint" key="InformationViewpoint"/>
</specification>