<?xml version="1.1" encoding="UTF-8"?>
<specification xmlns:xsi="http://www.w3.org/2001/XMLSchema-instance"
xsi:noNamespaceSchemaLocation="../schemas/specification.xsd" defaultVersion="4.4.1"
defaultWorkgroup="sd" url="http://www.hl7.org/implement/standards/product_brief.cfm?product_id=570">
<version code="4.4.1" deprecated="false"/>
<version code="4.4.1-snapshot" deprecated="true"/>
<version code="4.4.0" deprecated="false"/>
<version code="4.3.0" deprecated="false"/>
<version code="4.2.2" deprecated="false"/>
<version code="4.2.1" deprecated="true"/>
<version code="4.2.0" deprecated="true"/>
<version code="4.1.0" deprecated="true"/>
<version code="3.0.0" deprecated="true"/>
<version code="3.4.0" deprecated="true"/>
<version code="3.3.0" deprecated="false"/>
<version code="2.1.0" deprecated="true"/>
<page key="NA" name="(NA)"/>
<page key="many" name="(many)"/>
<page key="usecases" name="Use Cases"/>
<page key="narratives" name="Narrative Guidance"/>
<page key="templates" name="Templates"/>
<page key="figures-examples" name="Figures and Examples"/>
<page key="valuesets" name="Value sets"/>
<page key="samplefiles" name="Sample Files"/>
<page key="schematron" name="Schematron Validation Files"/>
</specification>
