<?xml version="1.0" encoding="UTF-8"?>
<specification gitUrl="https://github.com/HL7/cql" url="http://cql.hl7.org" ciUrl="http://build.fhir.org/ig/HL7/cql" defaultWorkgroup="cds" defaultVersion="1.5.3" xmlns:xsi="http://www.w3.org/2001/XMLSchema-instance" xsi:noNamespaceSchemaLocation="../schemas/specification.xsd">
  <version code="1.0" url="http://www.hl7.org/documentcenter/public/standards/dstu/HL7_CQLANG_R1_DSTU_2015MAY.zip" deprecated="true"/>
  <version code="1.1" url="http://www.hl7.org/documentcenter/public/standards/dstu/HL7_CQL_SPEC_R1_DSTUR1dot1_2016JUL.zip" deprecated="true"/>
  <version code="1.2" url="http://cql.hl7.org/STU2" deprecated="true"/>
  <version code="1.3" url="http://cql.hl7.org/STU3" deprecated="true"/>
  <version code="1.4" url="http://cql.hl7.org/STU4" deprecated="true"/>
  <version code="1.5" deprecated="true"/>
  <version code="1.4.0" url="http://cql.hl7.org/STU4" deprecated="true"/>
  <version code="1.5.0" url="http://cql.hl7.org/2020May" deprecated="true"/>
  <version code="1.5.1" url="http://cql.hl7.org/N1" deprecated="true"/>
  <version code="1.5.2" url="http://cql.hl7.org/N1" deprecated="true"/>
  <version code="1.5.3" url="http://cql.hl7.org/N1A"/>
  <version code="2.0.0-ballot" url="http://cql.hl7.org/2025Sep" deprecated="true"/>
  <version code="2.0.0" url="http://cql.hl7.org/R2"/>
  <page name="(NA)" key="NA"/>
  <page name="Index" key="index"/>
  <page name="Documentation" key="documentation"/>
  <page name="Grammar" key="grammar"/>
  <page name="ELM" key="elm"/>
  <page name="Examples" key="examples"/>
  <page name="Tests" key="tests"/>
  <page name="Downloads" key="downloads"/>
  <page name="History" key="history"/>
  <page name="Introduction" key="introduction"/>
  <page name="Authors Guide" key="authorsguide"/>
  <page name="Developers Guide" key="developersguide"/>
  <page name="Logical Specification" key="logicalspecification"/>
  <page name="Language Semantics" key="languagesemantics"/>
  <page name="Translation Semantics" key="translationsemantics"/>
  <page name="Physical Representation" key="physicalrepresentation"/>
  <page name="Appendix A - Syntax" key="appendixa"/>
  <page name="Appendix B - Reference" key="appendixb"/>
  <page name="Appendix C - Implementations" key="appendixc"/>
  <page name="Appendix D - References" key="appendixd"/>
  <page name="Appendix E - Acronyms" key="appendixe"/>
  <page name="Appendix F - Glossary" key="appendixf"/>
  <page name="Appendix G - Conventions" key="appendixg"/>
  <page name="Appendix H - Interval Examples" key="appendixh"/>
  <page name="Appendix I - FHIRPath Translation" key="appendixi"/>
  <page name="Appendix J - List of Tables" key="appendixj"/>
  <page name="Appendix K - List of Figures" key="appendixk"/>
  <page name="Appendix L - CQL Syntax Diagrams" key="appendixl"/>
  <page name="Appendix M - Messages" key="appendixm"/>
</specification>
