<?xml version="1.0" encoding="UTF-8"?>
<specification gitUrl="https://github.com/HL7/patient-reported-outcomes" url="http://hl7.org/fhir/us/patient-reported-outcomes" ciUrl="http://build.fhir.org/ig/HL7/patient-reported-outcomes" defaultWorkgroup="pharm" defaultVersion="0.1" xmlns:xsi="http://www.w3.org/2001/XMLSchema-instance" xsi:noNamespaceSchemaLocation="../schemas/specification.xsd">
  <version code="0.1"/>
  <artifactPageExtension value="-definitions"/>
  <artifactPageExtension value="-examples"/>
  <artifactPageExtension value="-mappings"/>
  <artifact name="Questionnaire" key="Questionnaire" deprecated="true"/>
  <page name="(NA)" key="NA"/>
  <page name="(many)" key="many"/>
  <page name="(profiles)" key="profiles"/>
  <page name="index" key="index"/>
  <page name="documentation" key="documentation" url="documentation" deprecated="true"/>
  <page name="downloads" key="downloads" url="downloads" deprecated="true"/>
  <page name="overview" key="overview" url="overview" deprecated="true"/>
  <page name="terminologies" key="terminologies" url="terminologies" deprecated="true"/>
</specification>
