<?xml version="1.0" encoding="UTF-8"?>
<specification xmlns:xsi="http://www.w3.org/2001/XMLSchema-instance" gitUrl="https://github.com/HL7/fhir-ipa"
               url="http://hl7.org/fhir/uv/ipa"
               ciUrl="https://build.fhir.org/ig/HL7/fhir-ipa"
               defaultWorkgroup="pc"
               defaultVersion="1.0.0"
               xsi:noNamespaceSchemaLocation="../schemas/specification.xsd">
               <!-- ballotUrl="http://hl7.org/fhir/uv/ips/2019Sep"> -->
   <version code="current" url="https://build.fhir.org/ig/HL7/fhir-ipa"/>
   <version code="1.0.0" url="http://hl7.org/fhir/uv/ipa/STU1"/>
   <version code="0.1"/>
   <artifactPageExtension value="-definitions"/>
   <artifactPageExtension value="-examples"/>
   <artifactPageExtension value="-mappings"/>
   <artifact id="CapabilityStatement/ipa-server" key="CapabilityStatement-ipa-server" name="CapabilityStatement - International Patient Access"/>
   <artifact id="OperationDefinition/docref" key="OperationDefinition-docref" name="IPA Fetch DocumentReference"/>
   <artifact id="StructureDefinition/ipa-allergyintolerance" key="StructureDefinition-ipa-allergyintolerance" name="IPA-AllergyIntolerance"/>
   <artifact id="StructureDefinition/ipa-condition" key="StructureDefinition-ipa-condition" name="IPA-Condition"/>
   <artifact id="StructureDefinition/ipa-documentreference" key="StructureDefinition-ipa-documentreference" name="IPA-DocumentReference"/>
   <artifact id="StructureDefinition/ipa-immunization" key="StructureDefinition-ipa-immunization" name="IPA-Immunization"/>
   <artifact id="StructureDefinition/ipa-medication" key="StructureDefinition-ipa-medication" name="IPA-Medication"/>
   <artifact id="StructureDefinition/ipa-medicationrequest" key="StructureDefinition-ipa-medicationrequest" name="IPA-MedicationRequest"/>
   <artifact id="StructureDefinition/ipa-medicationstatement" key="StructureDefinition-ipa-medicationstatement" name="IPA-MedicationStatement"/>
   <artifact id="StructureDefinition/ipa-observation" key="StructureDefinition-ipa-observation" name="IPA-Observation"/>
   <artifact id="StructureDefinition/ipa-patient" key="StructureDefinition-ipa-patient" name="IPA-Patient"/>
   <artifact id="StructureDefinition/ipa-practitioner" key="StructureDefinition-ipa-practitioner" name="IPA-Practitioner"/>
   <artifact id="StructureDefinition/ipa-practitionerrole" key="StructureDefinition-ipa-practitionerrole" name="IPA-PractitionerRole"/>
   <page name="(NA)" key="NA"/>
   <page name="(many)" key="many"/>
   <page name="Table of Contents" key="toc"/>
   <page name="International Patient Access Implementation Guide" key="index"/>
   <page key="artifacts" name="Artifact List"/>
   <page key="conformance" name="Conforming to this specification"/>
   <page key="downloads" name="Downloads"/>
   <page key="fetching" name="Finding / Retrieving information about the patient"/>
   <page key="access" name="Gaining Access to a patient record"/>
   <page key="ipa-server" name="IPA Server Rules"/>
   <page key="internationalization" name="Internationalization Issues"/>
</specification>
