<?xml version="1.1" encoding="UTF-8"?>
	<specification xmlns:xsi="http://www.w3.org/2001/XMLSchema-instance"
		xsi:noNamespaceSchemaLocation="schemas/specification.xsd" defaultVersion="2.1.0"
		defaultWorkgroup="sd" url="http://www.hl7.org/implement/standards/product_brief.cfm?product_id=426">
		<!--<specification xmlns:xsi="http://www.w3.org/2001/XMLSchema-instance"
 xsi:noNamespaceSchemaLocation="schemas/specification.xsd" defaultVersion="STU1"
 defaultWorkgroup="sd">-->
		<version url="http://www.hl7.org/implement/standards/product_brief.cfm?product_id=419" deprecated="false" code="2.1.0"/>
		<page key="NA" name="(NA)"/>
		<page key="many" name="(many)"/>
		<page key="usecases" name="Use Cases"/>
		<page key="narratives" name="Narrative Guidance"/>
		<page key="templates" name="Templates"/>
		<page key="figures-examples" name="Figures and Examples"/>
		<page key="valuesets" name="Value sets"/>
		<page key="samplefiles" name="Sample Files"/>
		<page key="schematron" name="Schematron Validation Files"/>
	</specification>
	