<?xml version="1.0" encoding="UTF-8"?>
<specification gitUrl="https://github.com/HL7/coordinated-registry-network" url="http://hl7.org/fhir/us/womens-health-registries" ciUrl="http://build.fhir.org/ig/HL7/coordinated-registry-network" defaultWorkgroup="brr" defaultVersion="0.1" xmlns:xsi="http://www.w3.org/2001/XMLSchema-instance" xsi:noNamespaceSchemaLocation="../schemas/specification.xsd">
  <version code="0.1"/>
  <artifactPageExtension value="-definitions"/>
  <artifactPageExtension value="-examples"/>
  <artifactPageExtension value="-mappings"/>
  <artifact name="Device" key="Device" deprecated="true"/>
  <artifact name="Procedure" key="Procedure" deprecated="true"/>
  <page name="(NA)" key="NA"/>
  <page name="(many)" key="many"/>
  <page name="(profiles)" key="profiles"/>
  <page name="index" key="index"/>
  <page name="overview" key="overview" url="overview" deprecated="true"/>
  <page name="schemas-schematrons" key="schemas-schematrons" url="schemas-schematrons" deprecated="true"/>
</specification>
