<?xml version="1.0" encoding="UTF-8"?>
<specification defaultWorkgroup="mh" defaultVersion="1.0-ballot" url="http://www.hl7.org/documentcenter/public/ballots/2025MAY/downloads/HL7_RCC-MH_E1_S1_2025MAY.pdf" xmlns:xsi="http://www.w3.org/2001/XMLSchema-instance" xsi:noNamespaceSchemaLocation="../schemas/specification.xsd">
  <version code="1.0-ballot" deprecated="false"/>
  <page name="Foreward" key="foreword"/>
  <page name="Introduction" key="introduction"/>
  <page name="Scope" key="scope"/>
  <page name="Normative references" key="normref"/>
  <page name="Terms and definitions" key="termsdef"/>
  <page name="Abbreviations" key="abbrev"/>
  <page name="RCC-MH care locations and evolution" key="careloc"/>
  <page name="RCC-MH relevant care delivery modes and use cases" key="caredelivery"/>
  <page name="RCC-MH challenges and gaps" key="gaps"/>
  <page name="RCC-MH recommendations" key="recommendations"/>
  <page name="Conclusions and path forward" key="conclusions"/>
  <page name="Annex A" key="annexa"/>
  <page name="Annex B" key="annexb"/>
  <page name="Annex C" key="annexc"/>
  <page name="Annex D" key="annexd"/>
  <page name="Annex E" key="annexe"/>
  <page name="Annex F" key="annexf"/>
  <page name="Annex G" key="annexg"/>
  <page name="Annex H" key="annexh"/>
  <page name="Annex I" key="annexi"/>
  <page name="Annex J" key="annexj"/>
  <page name="Annex K" key="annexk"/>
  <page name="Annex L" key="annexl"/>
  <page name="Bibliography" key="bibliography"/>
</specification>