<?xml version="1.0" encoding="UTF-8"?>
<specification defaultWorkgroup="pharm" defaultVersion="1.0" url="http://www.hl7.org/documentcenter/public/ballots/2021MAY/downloads/HL7_STD_MED_PROFILE_R1_I1_2021MAY.pdf" xmlns:xsi="http://www.w3.org/2001/XMLSchema-instance" xsi:noNamespaceSchemaLocation="../schemas/specification.xsd">
  <version code="1.0" deprecated="false"/>
  <page name="Purpose" key="purpose"/>
  <page name="Background and Significance" key="background"/>
  <page name="Joint NCPDP/HL7 Project Effort" key="joint_effort"/>
  <page name="NCPDP/HL7 Gap Analysis" key="gap_analysis"/>
  <page name="Analysis of Information" key="info_analysis"/>
  <page name="Recommendation and Conclusion" key="recomm"/>
  <page name="References" key="refs"/>
  <page name="Appendix" key="append"/>
</specification>