<?xml version="1.0" encoding="UTF-8"?>
<specification defaultWorkgroup="oo" defaultVersion="2.5.1_E5" url="https://www.hl7.org/implement/standards/product_brief.cfm?product_id=279" xmlns:xsi="http://www.w3.org/2001/XMLSchema-instance" xsi:noNamespaceSchemaLocation="../schemas/specification.xsd">
  <version code="2.5.1_E5" deprecated="false"/> 
  <version code="2.5.1_E6_2026May" deprecated="false"/> 
  <version code="V251_IG_LRI_E1_STU5_2024Jan" deprecated="true"/>   
  <version code="2.5.1_R1_STU4" deprecated="true"/> 
  <version code="2.5.1_R1_2022JUL-PR" deprecated="true"/>
  <version code="2.5.1_R1_2021SEP" deprecated="true"/>
  <version code="2.5.1_R1_STU3" deprecated="true"/>
  <version code="2.5.1_R1_DSTU2" deprecated="true"/>
  <version code="2.5.1_R1_DSTU1" deprecated="true"/>
  <artifact name="ORU^R01 Profile" key="ORUprofile" id="ORU/LRI"/>
  <artifact name="ACK^R01 Accept Profile" key="ACKacceptprofile" id="ACK/LRIaccept"/>
  <artifact name="ACK^R01 Application Profile" key="ACKapplicationprofile" id="ACK/LRIapplication"/>
  <artifact name="Batch Protocol Profile" key="Batchprofile" id="Batch/LRI"/>
  <artifact name="MSH_LRI Profile" key="MSH_LRI" id="MSH/LRI"/>
  <artifact name="SFT_LRI Profile" key="SFT_LRI" id="SFT/LRI"/>
  <artifact name="MSA_LRI Profile" key="MSA_LRI" id="MSA/LRI"/>
  <artifact name="ERR_LRI Profile" key="ERR_LRI" id="ERR/LRI"/>
  <artifact name="PID_LRI Profile" key="PID_LRI" id="PID/LRI"/>
  <artifact name="PRT_LRI Profile" key="PRT_LRI" id="PRT/LRI"/>
  <artifact name="NK1_LRI Profile" key="NK1_LRI" id="NK1/LRI"/>
  <artifact name="PV1_LRI Profile" key="PV1_LRI" id="PV1/LRI"/>
  <artifact name="ORC_LRI Profile" key="ORC_LRI" id="ORC/LRI"/>
  <artifact name="OBR_LRI Profile" key="OBR_LRI" id="OBR/LRI"/>
  <artifact name="TQ1_LRI Profile" key="TQ1_LRI" id="TQ1/LRI"/>
  <artifact name="OBX_LRI Profile" key="OBX_LRI" id="OBX/LRI"/>
  <artifact name="SPM_LRI Profile" key="SPM_LRI" id="SPM/LRI"/>
  <artifact name="NTE_LRI Profile" key="NTE_LRI" id="NTE/LRI"/>
  <artifact name="FHS_LRI Profile" key="FHS_LRI" id="FHS/LRI"/>
  <artifact name="FTS_LRI Profile" key="FTS_LRI" id="FTS/LRI"/>
  <artifact name="BHS_LRI Profile" key="BHS_LRI" id="BHS/LRI"/>
  <artifact name="BTS_LRI Profile" key="BTS_LRI" id="BTS/LRI"/>
  <artifact name="Data Type Flavors" key="datatypeflavors" id="DATATYPES/CCHD"/>
  <page name="Introduction" key="intro"/>
  <page name="Laboratory Results Use Case" key="results"/>
  <page name="Public Health Reporting Use Case" key="publichealth"/>
  <page name="Newborn Dried Blood Spot Use Case" key="ndbs"/>
  <page name="Clinical Genomics Use Case" key="genomics"/>
  <page name="Pandemic Response (reporting to US HHS) Use Case" key="pandemicresponse"/>
  <page name="Conformance" key="conformance"/>
  <page name="Acknowledgments" key="acknowledgements"/>
  <page name="Code Systems" key="codesystems"/>
  <page name="Cancer Registry Pathology Reporting" key="naaccr"/>
  <page name="Message Development Resources" key="resources"/>
  <page name="Additional Implementation Guidance - Culture" key="cultureguidance"/>
  <page name="Additional Implementation Guidance - Other" key="otherguidance"/>
  <page name="Clinical Genomics Code Systems" key="cgcodesystems"/>
  <page name="NDBS LOINC Requirements" key="ndbsloinc"/>
  <page name="Glossary" key="glossary"/>
  <page name="Other" key="other"/>
  <page key="TBD" name="TBD"/>
  <page name="Value Sets" key="valuesets"/>
</specification>