<?xml version="1.0" encoding="UTF-8"?>
<specification defaultWorkgroup="oo" defaultVersion="1.1" xmlns:xsi="http://www.w3.org/2001/XMLSchema-instance" xsi:noNamespaceSchemaLocation="../schemas/specification.xsd">
  <version code="1.1"/>
  <artifact name="ORU^R01 Profile" key="ORUprofile" id="ORU/ELR"/>
  <artifact name="ACK^R01 Profile" key="ACKprofile" id="ACK/ELR"/>
  <artifact name="Batch Protocol Profile" key="Batchprofile" id="Batch/ELR"/>
  <artifact name="MSH_ELR Profile" key="MSH_ELR" id="MSH/ELR"/>
  <artifact name="SFT_ELR Profile" key="SFT_ELR" id="SFT/ELR"/>
  <artifact name="MSA_ELR Profile" key="MSA_ELR" id="MSA/ELR"/>
  <artifact name="ERR_ELR Profile" key="ERR_ELR" id="ERR/ELR"/>
  <artifact name="PID_ELR Profile" key="PID_ELR" id="PID/ELR"/>
  <artifact name="NK1_ELR Profile" key="NK1_ELR" id="NK1/ELR"/>
  <artifact name="PV1_ELR Profile" key="PV1_ELR" id="PV1/ELR"/>
  <artifact name="ORC_ELR Profile" key="ORC_ELR" id="ORC/ELR"/>
  <artifact name="OBR_ELR Profile" key="OBR_ELR" id="OBR/ELR"/>
  <artifact name="TQ1_ELR Profile" key="TQ1_ELR" id="TQ1/ELR"/>
  <artifact name="OBX_ELR Profile" key="OBX_ELR" id="OBX/ELR"/>
  <artifact name="SPM_ELR Profile" key="SPM_ELR" id="SPM/ELR"/>
  <artifact name="NTE_ELR Profile" key="NTE_ELR" id="NTE/ELR"/>
  <artifact name="FHS_ELR Profile" key="FHS_ELR" id="FHS/ELR"/>
  <artifact name="FTS_ELR Profile" key="FTS_ELR" id="FTS/ELR"/>
  <artifact name="BHS_ELR Profile" key="BHS_ELR" id="BHS/ELR"/>
  <artifact name="BTS_ELR Profile" key="BTS_ELR" id="BTS/ELR"/>
  <artifact name="Data Type Flavors" key="datatypeflavors" id="DATATYPES/CCHD"/>
  <page name="Introduction" key="intro"/>
  <page name="PH Component" key="phcomponent"/>
  <page name="Purpose" key="purpose"/>
  <page name="Audience" key="audience"/>
  <page name="Requisite Knowledge" key="reqknowledge"/>
  <page name="Organization of the Guide" key="organization"/>
  <page name="Scope" key="scope"/>
  <page name="Ambulatory Care Use Case" key="ambulatory"/>
  <page name="User Story" key="userstory"/>
  <page name="Assumptions" key="assumptions"/>
  <page name="Sequence Diagram" key="sequencediagram"/>
  <page name="Key Technical Decisions" key="techdecisions"/>
  <page name="Referenced Profiles" key="profiles"/>
  <page name="Actors" key="actors"/>
  <page name="Conformance to the Guide" key="conformance"/>
  <page name="Code Sysems and Value Sets" key="codes"/>
  <page name="Message Development Resources" key="resources"/>
  <page name="Additional Implementation Guidance - Culture" key="cultureguidance"/>
  <page name="Additional Implementation Guidance - Other" key="otherguidance"/>
  <page name="Additional Implementation Guidance - Public Health Reporting" key="phguidance"/>
  <page name="Appendix A (Glossary)" key="glossary"/>
  <page name="Appendix B (PH Resources)" key="phresources"/>
  <page name="Appendix C (Version Changes)" key="versionchanges"/>
  <page name="Appendix D (Release 1.0 to 1.1)" key="releasechanges"/>
  <page name="Other" key="other"/>
</specification>