<?xml version="1.0" encoding="UTF-8"?>
<specification defaultWorkgroup="as" defaultVersion="3.0" url="http://www.hl7.org/documentcenter/public/ballots/2023JAN/downloads/Arden%20Syntax%203.0_PDF.zip" xmlns:xsi="http://www.w3.org/2001/XMLSchema-instance" xsi:noNamespaceSchemaLocation="../schemas/specification.xsd">
  <version code="3.0" deprecated="false"/>
  <page name="WHATâ€™S NEW IN VERSION 3.0" key="new"/>
  <page name="SCOPE" key="scope"/>
  <page name="REFERENCED DOCUMENTS" key="references"/>
  <page name="TERMINOLOGY" key="terminology"/>
  <page name="SIGNIFICANCE AND USE" key="significance"/>
  <page name="MLM FORMAT" key="mlm_format"/>
  <page name="SLOT DESCRIPTIONS" key="slot_descriptions"/>
  <page name="STRUCTURED SLOT SYNTAX" key="slot_syntax"/>
  <page name="DATA TYPES" key="data_types"/>
  <page name="OPERATOR DESCRIPTIONS" key="operator_descriptions"/>
  <page name="LOGIC SLOT" key="logic_slot"/>
  <page name="DATA SLOT and plan" key="data_slot"/>
  <page name="FHIR ENABLED DATA ACCESS" key="fhir_data_access"/>
  <page name="ACTION SLOT" key="action_slot"/>
  <page name="EVOKE SLOT" key="evoke_slot"/>
  <page name="Annexes" key="annexes"/>
</specification>