<?xml version="1.0" encoding="UTF-8"?>
<!-- edited with XMLSpy v2020 rel. 2 sp1 (x64) (http://www.altova.com) by  (Cerner Corporation) -->
<specification defaultVersion="1.0" defaultWorkgroup="sd" url="http://www.hl7.org/implement/standards/product_brief.cfm?product_id=478" xmlns:xsi="http://www.w3.org/2001/XMLSchema-instance" xsi:noNamespaceSchemaLocation="../schemas/specification.xsd">
	<version url="http://www.hl7.org/implement/standards/product_brief.cfm?product_id=478" deprecated="false" code="1.0"/>
	<page url="http:www.hl7.orgimplementstandardsproduct_brief.cfmproduct_id478" key="ccdatemplatenutition" name="HL7 CDAÂ® R2 Implementation Guide: C-CDA R2.1 Supplemental Templates for Nutrition, Release 1 - US Realm"/>
	<page key="NA" name="(NA)"/>
	<page key="many" name="(many)"/>
	<page key="profiles" name="(profiles)"/>
	<page key="overview" name="Overview"/>
	<page key="usecases" name="Use Cases"/>
	<page key="documentation" name="Documentation" deprecated="true"/>
	<page key="index" name="Index" deprecated="true"/>
	<page key="narratives" name="Narrative Guidance"/>
	<page key="templates" name="Templates"/>
	<page key="figures" name="Figures and Examples"/>
	<page key="valuesets" name="Value sets"/>
	<page key="samplefiles" name="Sample Files"/>
	<page key="validationfiles" name="Validation Files"/>
	<page key="schematron" name="Schematron"/>
</specification>
