<?xml version="1.0" encoding="UTF-8"?>
<specification gitUrl="https://github.com/HL7/cdisc-lab" url="http://hl7.org/fhir/uv/cdisc-lab" ciUrl="http://build.fhir.org/ig/HL7/cdisc-lab" defaultWorkgroup="brr" defaultVersion="0.1" xmlns:xsi="http://www.w3.org/2001/XMLSchema-instance" xsi:noNamespaceSchemaLocation="../schemas/specification.xsd">
  <version code="1.0.0" url="https://hl7.org/fhir/uv/cdisc-lab/STU1"/>
  <version code="0.1" deprecated="true"/>
  <artifactPageExtension value="-definitions"/>
  <artifactPageExtension value="-examples"/>
  <artifactPageExtension value="-mappings"/>
  <page name="(NA)" key="NA"/>
  <page name="(many)" key="many"/>
  <page name="(profiles)" key="profiles"/>
  <page name="overview" key="overview"/>
  <page name="usecases" key="usecases"/>
</specification>