<?xml version="1.0" encoding="UTF-8"?>
<specification defaultWorkgroup="pher" defaultVersion="2.1" xmlns:xsi="http://www.w3.org/2001/XMLSchema-instance" xsi:noNamespaceSchemaLocation="../schemas/specification.xsd">
 <version code="2.0"/>
 <version code="2.1"/>
 <artifact name="MEDICAL CERTIFIER DEATH INFORMATION Profile Component" key="MCDIprofile" id="ADT/MCDI"/>
 <artifact name="FUNERAL DIRECTOR DEATH INFORMATION Profile Component" key="FDDIprofile" id="ADT/FDFDI"/>
 <artifact name="JURISDICTION DEATH INFORMATION Profile Component" key="JDIprofile" id="ADT/JDI"/>
 <artifact name="CODED CAUSE OF DEATH INFORMATION Profile Component" key="CCODIprofile" id="ADT/CCODI"/>
 <artifact name="CODED RACE AND ETHNICITY INFORMATION Profile Component" key="CREIprofile" id="ADT/CREI"/>
 <artifact name="IMMEDIATE DEATH NOTIFICATION Conformance Profile" key="IDNA04" id="ADT/IDNA04"/>
 <artifact name="CANCEL DEATH NOTIFICATION Conformance Profile" key="IDNA11" id="ADT/IDNA11"/>
 <artifact name="REPORT CASE IDENTIFIER Conformance Profile" key="CIAA04" id="ADT/CIAA04"/>
 <artifact name="REPORT CERTIFIER DEATH REGISTRATION Conformance Profile" key="MCDIA04" id="ADT/MCDIA04"/>
 <artifact name="REVISE CERTIFIER DEATH REGISTRATION Conformance Profile" key="MCDIA08" id="ADT/MCDIA08"/>
 <artifact name="CANCEL CERTIFIER DEATH REGISTRATION Conformance Profile" key="MCDIA11" id="ADT/MCDIA11"/>
 <artifact name="REPORT FUNERAL DIRECTOR DEATH INFORMATION Conformance Profile" key="FDDIA04" id="ADT/FDDIA04"/>
 <artifact name="REVISE FUNERAL DIRECTOR DEATH INFORMATION Conformance Profile" key="FDDIA08" id="ADT/FDDIA08"/>
 <artifact name="CANCEL FUNERAL DIRECTOR DEATH INFORMATION Conformance Profile" key="FDDIA11" id="ADT/FDDIA11"/>
 <artifact name="REPORT JURISDICTION DEATH REGISTRATION Conformance Profile" key="JDIA04" id="ADT/JDIA04"/>
 <artifact name="REVISE JURISDICTION DEATH REGISTRATION Conformance Profile" key="JDIA08" id="ADT/JDIA08"/>
 <artifact name="CANCEL JURISDICTION DEATH REGISTRATION Conformance Profile" key="JDIA11" id="ADT/JDIA11"/>
 <artifact name="REPORT VOID CERTIFICATE Conformance Profile" key="RVCA04" id="ADT/RVCA04"/>
 <artifact name="REPORT CODED CAUSE OF DEATH Conformance Profile" key="CCODA04" id="ADT/CCODA04"/>
 <artifact name="REVISE CODED CAUSE OF DEATH REPORT Conformance Profile" key="CCODA08" id="ADT/CCODA08"/>
 <artifact name="CANCEL CODED CAUSE OF DEATH REPORT Conformance Profile" key="CCODA11" id="ADT/CCODA11"/>
 <artifact name="REPORT CODED RACE AND ETHNICITY Conformance Profile" key="CREIA04" id="ADT/CREIA04"/>
 <artifact name="REVISE CODED RACE AND ETHNICITY REPORT Conformance Profile" key="CREIA08" id="ADT/CREIA08"/>
 <artifact name="ACKNOWLEDGEMENT Conformance Profile" key="ACK" id="ADT/ACK"/>
 <artifact name="REPORT CERTIFIER DEATH REGISTRATION Composite Profile" key="CP_MCDIA04" id="ADT/CP_MCDIA04"/>
 <artifact name="REVISE CERTIFIER DEATH REGISTRATION Composite Profile" key="CP_MCDIA08" id="ADT/CP_MCDIA08"/>
 <artifact name="REPORT DEMOGRAPHIC DEATH INFORMATION Composite Profile" key="CP_FDDIA04" id="ADT/CP_FDDIA04"/>
 <artifact name="REVISE DEMOGRAPHIC DEATH INFORMATION Composite Profile" key="CP_FDDIA08" id="ADT/CP_FDDIA08"/>
 <artifact name="REPORT JURISDICTION DEATH REGISTRATION Composite Profile" key="CP_JDIA04" id="ADT/CP_JDIA04"/>
 <artifact name="REVISE JURISDICTION DEATH REGISTRATION Composite Profile" key="CP_JDIA08" id="ADT/CP_JDIA08"/>
 <artifact name="CODED CAUSE OF DEATH Composite Profile" key="CP_CCODA04" id="ADT/CP_CCODA04"/>
 <artifact name="CODED CAUSE OF DEATH REPORT Composite Profile" key="CP_CCODA08" id="ADT/CP_CCODA08"/>
 <artifact name="CODED RACE AND ETHNICITY Composite Profile" key="CP_CREIA04" id="ADT/CP_CREIA04"/>
 <artifact name="CODED RACE AND ETHNICITY REPORT Composite Profile" key="CP_CREIA08" id="ADT/CP_CREIA08"/>
 <artifact name="ERR_DR Composite Profile" key="ERR_DR" id="ERR/DR"/>
 <artifact name="EVN_DR Composite Profile" key="EVN_DR" id="EVN/DR"/>
 <artifact name="MSA_DR Composite Profile" key="MSA_DR" id="MSA/DR"/>
 <artifact name="MSH_DR Composite Profile" key="MSH_DR" id="MSH/DR"/>
 <artifact name="OBX_DR Composite Profile" key="OBX_DR" id="OBX/DR"/>
 <artifact name="OBX_DR_CCODA04 Composite Profile" key="OBX_DR_CCODA04" id="OBX/DR_CCODA04"/>
 <artifact name="OBX_DR_CCODA08 Composite Profile" key="OBX_DR_CCODA08" id="OBX/DR_CCODA08"/>
 <artifact name="OBX_DR_CREIA04 Composite Profile" key="OBX_DR_CREIA04" id="OBX/DR_CREIA04"/>
 <artifact name="OBX_DR_CREIA08 Composite Profile" key="OBX_DR_CREIA08" id="OBX/DR_CREIA08"/>
 <artifact name="OBX_DR_DRA04 Composite Profile" key="OBX_DR_DRA04" id="OBX/DR_DRA04"/>
 <artifact name="OBX_DR_DRA08 Composite Profile" key="OBX_DR_DRA08" id="OBX/DR_DRA08"/>
 <artifact name="OBX_DR_FDDIA04 Composite Profile" key="OBX_DR_FDDIA04" id="OBX/DR_FDDIA04"/>
 <artifact name="OBX_DR_FDDIA08 Composite Profile" key="OBX_DR_FDDIA08" id="OBX/DR_FDDIA08"/>
 <artifact name="OBX_DR_JDIA04 Composite Profile" key="OBX_DR_JDIA04" id="OBX/DR_JDIA04"/>
 <artifact name="OBX_DR_JDIA08 Composite Profile" key="OBX_DR_JDIA08" id="OBX/DR_JDIA08"/>
 <artifact name="OBX_DR_MCDIA04 Composite Profile" key="OBX_DR_MCDIA04" id="OBX/DR_MCDIA04"/>
 <artifact name="OBX_DR_MCDIA08 Composite Profile" key="OBX_DR_MCDIA08" id="OBX/DR_MCDIA08"/>
 <artifact name="PDA_DR_JDI Composite Profile" key="PDA_DR_JDI" id="PDA/DR_JDI"/>
 <artifact name="PDA_DR_PSDI Composite Profile" key="PDA_DR_PSDI" id="PDA/DR_PSDI"/>
 <artifact name="PID_DR_CREI Composite Profile" key="PID_DR_CREI" id="PID/DR_CREI"/>
 <artifact name="PID_DR_DEM Composite Profile" key="PID_DR_DEM" id="PID/DR_DEM"/>
 <artifact name="PID_DR_ID Composite Profile" key="PID_DR_ID" id="PID/DR_ID"/>
 <artifact name="PID_DR_JDI Composite Profile" key="PID_DR_JDI" id="PID/DR_JDI"/>
 <artifact name="PID_DR_MCDI Composite Profile" key="PID_DR_MCDI" id="PID/DR_MCDI"/>
 <artifact name="PV1_DR Composite Profile" key="PV1_DR" id="PV1/DR"/>
 <artifact name="Value Sets" key="valuesets" id="VALUESET/SS"/>
 <artifact name="Data Type Flavors" key="datatypeflavors" id="DATATYPES/SS"/>
 <page name="Introduction" key="intro"/>
 <page name="Messaging Framework" key="msgframe"/>
 <page name="Message Components" key="msgcomp"/>
 <page name="Use Cases" key="usecases"/>
 <page name="References" key="references"/>
 <page name="Examples" key="examples"/>
 <page name="Other" key="other"/>
</specification>