<?xml version="1.0" encoding="UTF-8"?>
<!-- This data is just for testing purposes and is not complete -->
<specification defaultWorkgroup="cgit" defaultVersion="R1.0" url="http://www.hl7.org/implement/standards/product_brief.cfm?product_id=533" xmlns:xsi="http://www.w3.org/2001/XMLSchema-instance" xsi:noNamespaceSchemaLocation="../schemas/specification.xsd">
  <version code="R1.0"/>
  <page name="Introduction" key="introduction"/>
  <page name="Profile Levels" key="profilelevels"/>
  <page name="V2 Implementation Guides" key="implementationguides"/>
  <page name="Message Profiles" key="messageprofiles"/>
  <page name="Constraints" key="constraints"/>
  <page name="Vocabulary Constraints" key="vocabconstraints"/>
  <page name="Profile Constraints" key="profileconstraints"/>
  <page name="Pairing Sender and Receiver Profiles" key="senderreceiver"/>
  <page name="Profile Documentation" key="profiledocumentation"/>
  <page name="Computable Document Definitions" key="computabledefinitions"/>
  <page name="Glossary" key="glossary"/>
  <page name="Appendix A" key="appendixa"/>
  <page name="Appendix B" key="appendixb"/>
  <page name="Other" key="other"/>
  <page key="TBD" name="TBD"/>
</specification>