<?xml version="1.1" encoding="UTF-8"?>
<specification xmlns:xsi="http://www.w3.org/2001/XMLSchema-instance"
	xsi:noNamespaceSchemaLocation="schemas/specification.xsd" defaultVersion="3.1.1"
	defaultWorkgroup="sd" url="https://github.com/HL7/CDA-phcaserpt">
  <version code="4.0.0-ballot" deprecated="false"/>
  <version code="3.1.1" deprecated="false"/>
  <version code="1.3.1" deprecated="true"/>
	<version code="1.3.0" deprecated="true"/>
	<version code="1.2.0" deprecated="true"/>
	<version code="1.1.1" deprecated="false"/>
	<page key="NA" name="(NA)"/>
	<page key="many" name="(many)"/>
	<page key="usecases" name="Use Cases"/>
	<page key="narratives" name="Narrative Guidance"/>
	<page key="templates" name="Templates"/>
	<page key="figures-examples" name="Figures and Examples"/>
	<page key="valuesets" name="Value sets"/>
	<page key="samplefiles" name="Sample Files"/>
	<page key="schematron" name="Schematron Validation Files"/>
	<page key="TBD" name="TBD"/>
</specification>
