<?xml version="1.1" encoding="UTF-8"?>
<specification xmlns:xsi="http://www.w3.org/2001/XMLSchema-instance" xsi:noNamespaceSchemaLocation="schemas/specification.xsd" defaultVersion="1.1.0" defaultWorkgroup="pharm" url="http://www.hl7.org/implement/standards/product_brief.cfm?product_id=514">
	<!-- new version 1.2.0 added -->
	<version code="1.2.0" deprecated="false"/>
	<!-- -->
	<version code="1.2.0-ballot" deprecated="true"/>
	<version code="1.1.0" deprecated="true"/>
	<version code="1.0.0" deprecated="true"/>


	<artifact id="2.16.840.1.113883.10.21.4.4" name="UV ClinicalStatement Encounter" key="UVClinicalStatementMinimalEncounter"/>
	<artifact id="2.16.840.1.113883.10.21.4.3" name="UV ClinicalStatement Observation" key="UVClinicalStatementMinimalObservation"/>
	<artifact id="2.16.840.1.113883.10.21.4.12" name="UV Comment Activity" key="UVCommentactivity"/>
	<artifact id="2.16.840.1.113883.10.21.4.9" name="UV Dispense Event Reference" key="UVDispenseEventReference"/>
	<artifact id="2.16.840.1.113883.10.21.4.2" name="UV Dispense Request" key="UVDispenseRequest"/>
	<artifact id="2.16.840.1.113883.10.21.4.18" name="UV Ingredient" key="UVIngredient"/>
	<artifact id="2.16.840.1.113883.10.21.4.15" name="UV Medication Dispense" key="UVMedicationDispense"/>
	<artifact id="2.16.840.1.113883.10.21.4.11" name="UV Medication Information (detail)" key="UVMedicationInformationdetail"/>
	<artifact id="2.16.840.1.113883.10.21.4.10" name="UV Medication Information (simple)" key="UVMedicationInformationsimple"/>
	<artifact id="2.16.840.1.113883.10.21.4.8" name="UV Medication Order Reference" key="UVMedicationOrderReference"/>
	<artifact id="2.16.840.1.113883.10.21.4.13" name="UV Medication Administration" key="UVMedicationadministration"/>
	<artifact id="2.16.840.1.113883.10.21.4.7" name="UV Medication Statement" key="UVMedicationstatement"/>
	<artifact id="2.16.840.1.113883.10.21.4.6" name="UV Subordinate Substance Administration" key="UVSubordinateadministration"/>
	<artifact id="2.16.840.1.113883.10.21.4.1" name="UV Medication Order" key="UVSubstanceadministrationrequest"/>
	<artifact id="2.16.840.1.113883.10.21.4.14" name="UV Substitution Event Adminstration" key="UVSubstitutionEventAdministration"/>
	<artifact id="2.16.840.1.113883.10.21.4.5" name="UV Substitution Permission" key="UVSubstitutionPermission"/>
	<artifact id="2.16.840.1.113883.10.21.4.17" name="UV Content" key="UVasContent"/>
	<artifact id="2.16.840.1.113883.10.21.4.19" name="UV Generalized Medicine Class" key="UVgeneralizedMedicineClass"/>
	<artifact id="2.16.840.1.113883.10.21.9.1" name="UV Use Period" key="Useperiod"/>
	<artifact id="2.16.840.1.113883.11.21.2" name="ActStatusActiveCompletedAbortedSuspended" key="ActStatusCodeActiveCompletedAbortedSuspended"/>
	<artifact id="2.16.840.1.113883.11.21.1" name="Medication Time Units (UCUM)" key="MedicationTimeUnits"/>
	<artifact id="2.16.840.1.113883.11.21.4" name="Mood Code Evn Int Rqo" key="MoodCodeEvnIntRqo"/>
	<artifact id="2.16.840.1.113883.11.21.5" name="Unknown or absent medication" key="Unknownorabsentmedication"/>



	<page key="NA" name="(NA)"/>
	<page key="many" name="(many)"/>
	<page key="usecases" name="Use Cases"/>
	<page key="narratives" name="Narrative Guidance"/>
	<page key="templates" name="Templates"/>
	<page key="figures-examples" name="Figures and Examples"/>
	<page key="valuesets" name="Value sets"/>
	<page key="samplefiles" name="Sample Files"/>
	<page key="schematron" name="Schematron Validation Files"/>
	<page key="TBD" name="TBD"/>

</specification>
	

