<?xml version="1.0" encoding="UTF-8"?>
<specification defaultWorkgroup="cds" defaultVersion="R1_DSTU1" url="http://www.hl7.org/implement/standards/product_brief.cfm?product_id=84" xmlns:xsi="http://www.w3.org/2001/XMLSchema-instance" xsi:noNamespaceSchemaLocation="../schemas/specification.xsd">
 <version code="R1_DSTU1" deprecated="false"/>
 <page name="Preface" key="preface"/>
 <page name="1 - Scope" key="1_scope"/>
 <page name="2 - Referenced Documents" key="2_doc_refs"/>
 <page name="3 - Overview" key="3_overview"/>
 <page name="4 - Exising Messages Used" key="4_messages_used"/>
 <page name="4.1 - Immunization" key="4_1_immunization"/>
 <page name="4.2 - Appointments" key="4_2_appointments"/>
 <page name="4.3 - Problem List" key="4_3_problem_list"/>
 <page name="4.4 - Medications" key="4_4_medications"/>
 <page name="4.5 - Allergies" key="4_5_allergies"/>
 <page name="4.6 - Lab Orders" key="4_6_lab_orders"/>
 <page name="4.7 - Observation data" key="4_7_obs_data"/>
 <page name="5 - Use of Structured OBX Segments" key="5_use_of_obx_seg"/>
 <page name="5.1 - Overview of Structured OBX data" key="5_1_struct_obx_data"/>
 <page name="5.2 - Presenting Complaint" key="5_2_complaint"/>
 <page name="5.3 - History of Past Illness" key="5_3_illness_history"/>
 <page name="5.4 - Procedures" key="5_4_procedures"/>
 <page name="5.5 - Family History" key="5_5_fam_hist"/>
 <page name="5.6 - Pregnancies" key="5_6_pregnancies"/>
 <page name="5.7 - Social History" key="5_7_soc_hist"/>
 <page name="5.8 - Substance Abuse" key="5_8_substance_abuse"/>
 <page name="5.9 - Exercise History" key="5_9_exercise_hist"/>
 <page name="5.10 - Vitals" key="5_10_vitals"/>
 <page name="5.11 - Alerts" key="5_11_alerts"/>
 <page name="6 - Summary" key="6_summary"/>
 <page name="7 - Example Message" key="7_example"/>
 <page name="8 - Appendix" key="8_appendix"/>
 <page name="8.1 - Appendix 1 - Structured OBX Principles" key="8_1_app_obx_prin"/>
 <page name="8.2 - Appendix 2 - Mapping to ISO 21090 Data Types" key="8_2_app_iso_dt_mapping"/>
 <page name="8.3 - LOINC Codes and long names used in this document" key="8_3_loinc_codes"/>
 <page name="8.4 - Appendix - Suggested LOINCs for Section Header value" key="8_4_app_loinc_header"/>
 <page name="8.5 - Appendix - Definitions" key="8_5_app_definitions"/>
</specification>